Sheet: Отчет
A1: [Report:Информация] | E1: Отчет о теплопотреблении по приборам УУТЭ | M1: [Конечная дата]
A2: [Report:Информация] | B2: Абонент: ОАО "СЗТ" Петербургский филиал Договор: | J2: [Договор] | M2: тел. 575-22-48 | P2: Узел учета: | S2: [Узел учета]
A3: [Report:Информация] | B3: Адрес: | C3: [Имя Узла Учета] | E3: [Адрес Узла Учета] | I3: Строительный адрес: | M3: [Стр.адрес] | P3: Код УУТЭ: | R3: [Код УУТЭ]
A4: [Report:Информация] | B4: Обслуживающая организация: Цех СОТ УОП Петербургского филиала ОАО "СЗТ" | O4: Телефон: 575-22-44
A5: [Report:Информация] | B5: Источник: | D5: [Источник] | G5: Схема подключения: | J5: [Сист_теплопотребления] | Q5: график | S5: [Т_график]
A6: [Report:Информация] | B6: Установлены приборы: | G6: Часовые архивы в файле: | K6: [Часов_архив] | Q6: Тхв,гр.С = | S6: [Тхв]
A7: [Report:Информация] | B7: Вычислитель: | D7: [Марка Счетчика] | F7: [№ прибора] | H7: Режим(схема): | J7: [Схема] | L7: Приборы УУТЭ поверены до : | R7: [Дата поверки]
A8: [Report:Информация] | B8: Подающ.тр.(М1): | E8: расходомер: | G8: [Расходомер] | I8: Gmin= | J8: [Gпр_minПР] | K8: Gmax= | M8: [GпрПР] | O8: Термопреобр.: | R8: [Термопреобр]
A9: [Report:Информация] | B9: Обратн.тр.(М2): | E9: расходомер: | G9: [Расходомер] | I9: Gmin= | J9: [Gпр_minПР] | K9: Gmax= | M9: [GпрПР] | O9: Термопреобр.: | R9: [Термопреобр]
A10: [Report:Информация] | B10: тр-д ГВС(М3): | E10: расходомер: | G10: [Расходомер ГВС] | I10: Gmin= | J10: [Gпр(гвс min)] | K10: Gmax= | M10: [G(гвс)ПР] | O10: Термопреобр.: | R10: [Термопреобр ГВС]
A11: [Report:Информация] | B11: тр.цирк.ГВС(М4): | E11: расходомер: | I11: Gmin= | K11: Gmax= | O11: Термопреобр.:
A12: [Report:Информация] | B12: тр.подпитки(V5): | E12: расходомер: | I12: Gmin= | K12: Gmax= | O12: Термопреобр.:
A13: [Report:Информация] | B13: Расчетный алгоритм: | G13: зима: | H13: [Формула] | N13: лето: | P13: [Формула2]
A14: [Report:Информация] | B14: Договорные нагрузки,Гкал/час: | G14: Qот.= | H14: [Qот] | I14: Qвент.= | J14: [Qвент] | L14: Qтех.= | M14: [Qтех] | N14: Qтех.гвс= | P14: [Qтех_гвс] | R14: Qгвс.= | S14: [Qгвс]
A15: [Report:Информация] | B15: Договорные нагрузки (ср.час),Гкал/час: | L15: Qтех.гвс ср= | O15: [Qтех_гвс ср] | Q15: Qгвс.ср= | S15: [Qгвс ср]
A16: [Report:Информация] | B16: Договорн. нагрузки (ср.сут),т/сут: | G16: Gот.= | H16: [Gот] | I16: Gвент.= | J16: [Gвент] | M16: Gтех.= | N16: [Gтех] | O16: Gгвс.= | P16: [Gгвс] | R16: Gгвс.м = | S16: [Gгвс_м]
A17: [Report:Информация] | B17: Конст.значения: | E17: Р1= | F17: [Рпр] | G17: Р2= | H17: [Робр] | I17: t1= | J17: [Т1] | K17: t2= | L17: [Т2] | M17: t3= | O17: t4=
B18: Фактическое потребление за предыдущий отчетный период
E19: Учет (ТВ-1) | M19: Контроль (ТВ-2)
B20: Дата | C20: Ти | D20: НС | E20: М1, | F20: М2, | G20: dМ, | H20: Т1, | I20: Т2, | J20: dТ, | K20: P1, | L20: P2, | M20: М3 | N20: M4, | O20: dM, | P20: V5, | Q20: Т3, | R20: Т4, | S20: Q | U20: Qгвс
C21: час | E21: т | F21: т | G21: т | H21: С | I21: С | J21: С | K21: кг/см2 | L21: кг/см2 | M21: т | N21: т | O21: т | P21: м.куб | Q21: С | R21: С | S21: Гкал
A22: [Report:Архив] | B22: [Время Опроса] | C22: 24 | E22: [M1 сут] | F22: [М2 сут] | G22: =RC[-2]-RC[-1] -> #VALUE! | H22: [T1 сут] | I22: [T2 сут] | J22: =RC[-2]-RC[-1] -> #VALUE! | K22: =R17C6*1 -> #VALUE! | L22: =R17C8*1 -> #VALUE! | N22: [М4 сут] | R22: [T4 сут] | S22: [Q1 сут] | U22: [Q2 сут]
B23: Среднее: | C23: =AVERAGE(R[-2]C:R[-1]C) -> 24 | E23: =AVERAGE(R[-2]C:R[-1]C) -> #DIV/0! | F23: =AVERAGE(R[-2]C:R[-1]C) -> #DIV/0! | G23: =AVERAGE(R[-2]C:R[-1]C) -> #VALUE! | H23: =AVERAGE(R[-2]C:R[-1]C) -> #DIV/0! | I23: =AVERAGE(R[-2]C:R[-1]C) -> #DIV/0! | J23: =AVERAGE(R[-2]C:R[-1]C) -> #VALUE! | K23: =AVERAGE(R[-2]C:R[-1]C) -> #VALUE! | L23: =AVERAGE(R[-2]C:R[-1]C) -> #VALUE! | N23: =AVERAGE(R[-2]C:R[-1]C) -> #DIV/0! | R23: =AVERAGE(R[-2]C:R[-1]C) -> #DIV/0! | S23: =AVERAGE(R[-2]C:R[-1]C) -> #DIV/0! | U23: =AVERAGE(R[-2]C:R[-1]C) -> #DIV/0!
B24: Итого | C24: =SUM(R[-3]C:R[-2]C) -> 24 | E24: =SUM(R[-3]C:R[-2]C) -> 0 | F24: =SUM(R[-3]C:R[-2]C) -> 0 | G24: =SUM(R[-3]C:R[-2]C) -> #VALUE! | N24: =SUM(R[-3]C:R[-2]C) -> 0 | S24: =SUM(R[-3]C:R[-2]C) -> 0 | U24: =SUM(R[-3]C:R[-2]C) -> 0
B25: Итого по приборам учета:
B26: Среднее:
B27: Итого:
B28: Показания счетчиков на момент снятия данных:
B29: Дата | D29: М1, т | F29: М2, т | H29: М3,т | J29: М4,т | L29: V5,м.куб | N29: Q, Гкал | Q29: Ти,ч | U29: Qгвс, Гкал
A30: [Report:Итоговые] | B30: [Время Опроса] | D30: [M1 сум] | F30: [M2 сум] | J30: [M4 сум] | N30: [Qтв1 сум] | Q30: [TSUM1] | U30: [Qтв2 сум]
B31: Период расчета по среднему:
B32: Период расчета по договору:
B33: Период превышения t2:
B34: Инженер ОПУ района Дирекции "Энергосбыт"ГУП "ТЭК СПб" | O34: / | R34: /
B36: Ответственный за учет тепловой энергии (от абонента) | O36: / | P36: Сухих Л.А. /
A41: [Report:Информация] | F41: Акт о теплопотреблении за | K41: [Конечная дата]
A43: [Report:Информация] | B43: Мы, нижеподписавшиеся: сотрудник Управления реализации дирекции Энергосбыт ГУП "ТЭК СПб" | Q43: [Фамилия]
A44: [Report:Информация] | B44: и представитель абонента | F44: [Имя Узла Учета] | H44: расположенного по адресу: | L44: [Адрес Узла Учета] | P44: составили
B45: настоящий акт в том, что за период включительно энергоснабжающая организация отпустила,
B46: а абонент принял тепловую энергию в количестве:
B47: Фактическое потребление за предыдущий отчетный период: | P47: = | S47: Гкал
B48: Расчетное потребление за предыдущий период: | P48: = | S48: Гкал
B49: Фактическое потребление за текущий отчетный период: | P49: = | S49: Гкал
B50: Расчетное потребление до конца месяца: | P50: = | S50: Гкал
B51: Корректировка на температуру холодной воды на источнике теплоснабжения | N51: гр.С | P51: = | S51: Гкал
B52: Расчет по среднему за период: | P52: = | S52: Гкал
B53: Расчет по договорным нагрузкам за период: | P53: = | S53: Гкал
B54: Досчет за нарушение договорных обязательств: | P54: = | S54: Гкал
B56: Итого: | P56: = | S56: Гкал
B60: Представитель абонента | Q60: Сухих Л.А.
A62: [Report:Информация] | B62: Сотрудник Управления реализации дирекции "Энергосбыт" ГУП"ТЭК СПб" | Q62: [Фамилия]

Sheet: Отчет (З)
A1: [Report:Информация] | E1: Отчет о теплопотреблении по приборам УУТЭ | M1: [Конечная дата]
A2: [Report:Информация] | B2: Абонент: ОАО "СЗТ" Петербургский филиал Договор: | J2: [Договор] | M2: тел. 575-22-48 | P2: Узел учета: | S2: [Узел учета]
A3: [Report:Информация] | B3: Адрес: | C3: [Имя Узла Учета] | E3: [Адрес Узла Учета] | I3: Строительный адрес: | M3: [Стр.адрес] | P3: Код УУТЭ: | R3: [Код УУТЭ]
A4: [Report:Информация] | B4: Обслуживающая организация: Цех СОТ УОП Петербургского филиала ОАО "СЗТ" | O4: Телефон: 575-22-44
A5: [Report:Информация] | B5: Источник: | D5: [Источник] | G5: Схема подключения: | J5: [Сист_теплопотребления] | Q5: график | S5: [Т_график]
A6: [Report:Информация] | B6: Установлены приборы: | G6: Часовые архивы в файле: | K6: [Часов_архив] | Q6: Тхв,гр.С = | S6: [Тхв]
A7: [Report:Информация] | B7: Вычислитель: | D7: [Марка Счетчика] | F7: [№ прибора] | H7: Режим(схема): | J7: [Схема] | L7: Приборы УУТЭ поверены до : | R7: [Дата поверки]
A8: [Report:Информация] | B8: Подающ.тр.(М1): | E8: расходомер: | G8: [Расходомер] | I8: Gmin= | J8: [Gпр_minПР] | K8: Gmax= | M8: [GпрПР] | O8: Термопреобр.: | R8: [Термопреобр]
A9: [Report:Информация] | B9: Обратн.тр.(М2): | E9: расходомер: | G9: [Расходомер] | I9: Gmin= | J9: [Gпр_minПР] | K9: Gmax= | M9: [GпрПР] | O9: Термопреобр.: | R9: [Термопреобр]
A10: [Report:Информация] | B10: тр-д ГВС(М3): | E10: расходомер: | G10: [Расходомер ГВС] | I10: Gmin= | J10: [Gпр(гвс min)] | K10: Gmax= | M10: [G(гвс)ПР] | O10: Термопреобр.: | R10: [Термопреобр ГВС]
A11: [Report:Информация] | B11: тр.цирк.ГВС(М4): | E11: расходомер: | I11: Gmin= | K11: Gmax= | O11: Термопреобр.:
A12: [Report:Информация] | B12: тр.подпитки(V5): | E12: расходомер: | I12: Gmin= | K12: Gmax= | O12: Термопреобр.:
A13: [Report:Информация] | B13: Расчетный алгоритм: | G13: зима: | H13: [Формула] | N13: лето: | P13: [Формула2]
A14: [Report:Информация] | B14: Договорные нагрузки,Гкал/час: | G14: Qот.= | H14: [Qот] | I14: Qвент.= | J14: [Qвент] | L14: Qтех.= | M14: [Qтех] | N14: Qтех.гвс= | P14: [Qтех_гвс] | R14: Qгвс.= | S14: [Qгвс]
A15: [Report:Информация] | B15: Договорные нагрузки (ср.час),Гкал/час: | L15: Qтех.гвс ср= | O15: [Qтех_гвс ср] | Q15: Qгвс.ср= | S15: [Qгвс ср]
A16: [Report:Информация] | B16: Договорн. нагрузки (ср.сут),т/сут: | G16: Gот.= | H16: [Gот] | I16: Gвент.= | J16: [Gвент] | M16: Gтех.= | N16: [Gтех] | O16: Gгвс.= | P16: [Gгвс] | R16: Gгвс.м = | S16: [Gгвс_м]
A17: [Report:Информация] | B17: Конст.значения: | E17: Р1= | F17: [Рпр] | G17: Р2= | H17: [Робр] | I17: t1= | J17: [Т1] | K17: t2= | L17: [Т2] | M17: t3= | O17: t4=
B18: Фактическое потребление за предыдущий отчетный период
E19: Учет (ТВ-1) | M19: Контроль (ТВ-2)
B20: Дата | C20: Ти | D20: НС | E20: М1, | F20: М2, | G20: dМ, | H20: Т1, | I20: Т2, | J20: dТ, | K20: P1, | L20: P2, | M20: М3 | N20: M4, | O20: dM, | P20: V5, | Q20: Т3, | R20: Т4, | S20: Q | U20: Qгвс
C21: час | E21: т | F21: т | G21: т | H21: С | I21: С | J21: С | K21: кг/см2 | L21: кг/см2 | M21: т | N21: т | O21: т | P21: м.куб | Q21: С | R21: С | S21: Гкал
A22: [Report:Архив] | B22: [Время Опроса] | C22: 24 | E22: [M1 сут] | F22: [М2 сут] | G22: =RC[-2]-RC[-1] -> #VALUE! | H22: [T1 сут] | I22: [T2 сут] | J22: =RC[-2]-RC[-1] -> #VALUE! | K22: =R17C6*1 -> #VALUE! | L22: =R17C8*1 -> #VALUE! | N22: [М4 сут] | R22: [T4 сут] | S22: [Q1 сут] | U22: [Q4 сут]
B23: Среднее: | C23: =AVERAGE(R[-2]C:R[-1]C) -> 24 | E23: =AVERAGE(R[-2]C:R[-1]C) -> #DIV/0! | F23: =AVERAGE(R[-2]C:R[-1]C) -> #DIV/0! | G23: =AVERAGE(R[-2]C:R[-1]C) -> #VALUE! | H23: =AVERAGE(R[-2]C:R[-1]C) -> #DIV/0! | I23: =AVERAGE(R[-2]C:R[-1]C) -> #DIV/0! | J23: =AVERAGE(R[-2]C:R[-1]C) -> #VALUE! | K23: =AVERAGE(R[-2]C:R[-1]C) -> #VALUE! | L23: =AVERAGE(R[-2]C:R[-1]C) -> #VALUE! | N23: =AVERAGE(R[-2]C:R[-1]C) -> #DIV/0! | R23: =AVERAGE(R[-2]C:R[-1]C) -> #DIV/0! | S23: =AVERAGE(R[-2]C:R[-1]C) -> #DIV/0! | U23: =AVERAGE(R[-2]C:R[-1]C) -> #DIV/0!
B24: Итого | C24: =SUM(R[-3]C:R[-2]C) -> 24 | E24: =SUM(R[-3]C:R[-2]C) -> 0 | F24: =SUM(R[-3]C:R[-2]C) -> 0 | G24: =SUM(R[-3]C:R[-2]C) -> #VALUE! | N24: =SUM(R[-3]C:R[-2]C) -> 0 | S24: =SUM(R[-3]C:R[-2]C) -> 0 | U24: =SUM(R[-3]C:R[-2]C) -> 0
B25: Показания счетчиков на момент снятия данных:
B26: Дата | D26: М1, т | F26: М2, т | H26: М3,т | J26: М4,т | L26: V5,м.куб | N26: Q, Гкал | Q26: Ти,ч | U26: Qгвс, Гкал
A27: [Report:Итоговые] | B27: [Время Опроса] | D27: [M1 сум] | F27: [M2 сум] | J27: [M4 сум] | N27: [Qтв1 сум] | Q27: [TSUM1] | U27: [Qтв4 сум]
B28: Период расчета по среднему:
B29: Период расчета по договору:
B30: Период превышения t2:
B31: Инженер ОПУ района Дирекции "Энергосбыт"ГУП "ТЭК СПб" | O31: / | R31: /
B33: Ответственный за учет тепловой энергии (от абонента) | O33: / | P33: Сухих Л.А. /
A38: [Report:Информация] | F38: Акт о теплопотреблении за | K38: [Конечная дата]
A40: [Report:Информация] | B40: Мы, нижеподписавшиеся: сотрудник Управления реализации дирекции Энергосбыт ГУП "ТЭК СПб" | Q40: [Фамилия]
A41: [Report:Информация] | B41: и представитель абонента | F41: [Имя Узла Учета] | H41: расположенного по адресу: | L41: [Адрес Узла Учета] | P41: составили
B42: настоящий акт в том, что за период включительно энергоснабжающая организация отпустила,
B43: а абонент принял тепловую энергию в количестве:
B44: Фактическое потребление за предыдущий отчетный период: | P44: = | S44: Гкал
B45: Расчетное потребление за предыдущий период: | P45: = | S45: Гкал
B46: Фактическое потребление за текущий отчетный период: | P46: = | S46: Гкал
B47: Расчетное потребление до конца месяца: | P47: = | S47: Гкал
B48: Корректировка на температуру холодной воды на источнике теплоснабжения | N48: гр.С | P48: = | S48: Гкал
B49: Расчет по среднему за период: | P49: = | S49: Гкал
B50: Расчет по договорным нагрузкам за период: | P50: = | S50: Гкал
B51: Досчет за нарушение договорных обязательств: | P51: = | S51: Гкал
B53: Итого: | P53: = | S53: Гкал
B57: Представитель абонента | Q57: Сухих Л.А.
A59: [Report:Информация] | B59: Сотрудник Управления реализации дирекции "Энергосбыт" ГУП"ТЭК СПб" | Q59: [Фамилия]

Sheet: Ленэнерго
H1: Отчет
A2: [Report:Информация] | D2: о потреблении тепловой энергии и теплоносителя за | L2: [Конечная дата]
A3: [Report:Информация] | B3: Абонент: | D3: [Имя Узла Учета] | H3: Источник: | L3: [Источник]
A4: [Report:Информация] | B4: Адрес: | D4: [Адрес Узла Учета] | H4: Магистраль теплосети: | L4: [Магистраль]
A5: [Report:Информация] | B5: Телефон: 575-22-48 | H5: Тепловая камера: | L5: [Теп_камера]
B6: Расчетные формулы: Fg=[G/(n*Gпр)]*100% dt=t1-t2
A7: [Report:Информация] | B7: Подающий, обратный тр-д: расходомер | H7: [Расходомер] | J7: диапазон изм.: | L7: [Gпр_minПР] | M7: [GпрПР] | N7: м куб./час
A8: [Report:Информация] | B8: Расходомер ГВС: | E8: [Расходомер ГВС] | J8: диапазон изм.: | L8: [Gпр(гвс min)] | M8: [G(гвс)ПР] | N8: м куб./час
A9: [Report:Информация] | B9: Теплосчетчик : | D9: [Марка Счетчика] | G9: Договорные расходы Gот = | K9: [Договор G2] | M9: Gгвс= | N9: [Gгвс]
A10: [Report:Информация] | B10: Договор № | D10: [Договор] | G10: Договорное давление Ри1= | K10: [Рпр] | L10: кг/см2 | M10: Ри2= | N10: [Робр] | O10: кг/см2
B11: , | D11: Подающий трубопровод | I11: Обратный трубопровод | N11: линия ГВС [т] (для контроля)
B12: Дата | C12: Часы | D12: Fg1 | E12: t1 | F12: P1 | G12: M1 | H12: dt | I12: Fg2 | J12: t2 | K12: P2 | L12: M2 | M12: M1-M2 | O12: Qсум
D13: % | E13: гр.C | F13: кг/см | G13: тонн | H13: гр.С | I13: % | J13: гр.C | K13: кг/см2 | L13: тонн | M13: тонн | O13: Гкал
A14: [Report:Архив] | B14: [Время Опроса] | C14: 24 | D14: =RC[3]/(RC[-1]*R7C13)*100% -> #VALUE! | E14: [T1 сут] | F14: =R10C11*1 -> #VALUE! | G14: [М1 сут] | H14: =RC[-3]-RC[2] -> #VALUE! | I14: =RC[3]/(RC[-6]*R7C13)*100% -> #VALUE! | J14: [T2 сут] | K14: =R10C14*1 -> #VALUE! | L14: [М2 сут] | M14: =RC[-6]-RC[-1] -> #VALUE! | N14: [М3 сут] | O14: [Qтв1 сут] | Q14: [T3 сут] | R14: [Q2 ] | S14: [М3 сут]
B15: Среднее: | D15: =AVERAGE(R[-2]C:R[-1]C) -> #VALUE! | E15: =AVERAGE(R[-2]C:R[-1]C) -> #DIV/0! | F15: =AVERAGE(R[-2]C:R[-1]C) -> #VALUE! | G15: =AVERAGE(R[-2]C:R[-1]C) -> #DIV/0! | H15: =AVERAGE(R[-2]C:R[-1]C) -> #VALUE! | I15: =AVERAGE(R[-2]C:R[-1]C) -> #VALUE! | J15: =AVERAGE(R[-2]C:R[-1]C) -> #DIV/0! | K15: =AVERAGE(R[-2]C:R[-1]C) -> #VALUE! | L15: =AVERAGE(R[-2]C:R[-1]C) -> #DIV/0! | M15: =AVERAGE(R[-2]C:R[-1]C) -> #VALUE! | N15: =AVERAGE(R[-2]C:R[-1]C) -> #DIV/0! | O15: =AVERAGE(R[-2]C:R[-1]C) -> #DIV/0!
B16: Итого: | C16: =SUM(R[-3]C:R[-2]C) -> 24 | G16: =SUM(R[-3]C:R[-2]C) -> 0 | L16: =SUM(R[-3]C:R[-2]C) -> 0 | M16: =SUM(R[-3]C:R[-2]C) -> #VALUE! | N16: =SUM(R[-3]C:R[-2]C) -> 0 | O16: =SUM(R[-3]C:R[-2]C) -> 0
B17: Показания параметров теплопотребления по теплосчетчику нарастающим итогом:
B18: Дата | E18: M1, т | G18: M2, т | I18: Qсум, Гкал | K18: Mгвс,т | M18: Tраб., час
A19: [Report:Итоговые] | B19: [Время Опроса] | E19: [M1 сум] | G19: [M2 сум] | I19: [Qтв1 сум] | K19: [M3 сум] | M19: [TSUM1 сум]
D21: Отчет сдал | H21: Сухих Л.А.

Sheet: Ленэнерго (2)
H1: Отчет
A2: [Report:Информация] | D2: о потреблении тепловой энергии и теплоносителя за | L2: [Конечная дата]
A3: [Report:Информация] | B3: Абонент: | D3: [Имя Узла Учета] | H3: Источник: | L3: [Источник]
A4: [Report:Информация] | B4: Адрес: | D4: [Адрес Узла Учета] | H4: Магистраль теплосети: | L4: [Магистраль]
A5: [Report:Информация] | B5: Телефон: 575-22-48 | H5: Тепловая камера: | L5: [Теп_камера]
B6: Расчетные формулы: Fg=[G/(n*Gпр)]*100% dt=t1-t2
A7: [Report:Информация] | B7: Подающий, обратный тр-д: расходомер | H7: [Расходомер] | J7: диапазон изм.: | L7: [Gпр_minПР] | M7: [GпрПР] | N7: м куб./час
A8: [Report:Информация] | B8: Расходомер ГВС: | E8: [Расходомер ГВС] | J8: диапазон изм.: | L8: [Gпр(гвс min)] | M8: [G(гвс)ПР] | N8: м куб./час
A9: [Report:Информация] | B9: Теплосчетчик : | D9: [Марка Счетчика] | G9: Договорные расходы Gот = | K9: [Договор G2] | M9: Gгвс= | N9: [Gгвс]
A10: [Report:Информация] | B10: Договор № | D10: [Договор] | G10: Договорное давление Ри1= | K10: [Рпр] | L10: кг/см2 | M10: Ри2= | N10: [Робр] | O10: кг/см2
B11: , | D11: Подающий трубопровод | I11: Обратный трубопровод | N11: линия ГВС [т] (для контроля)
B12: Дата | C12: Часы | D12: Fg1 | E12: t1 | F12: P1 | G12: M1 | H12: dt | I12: Fg2 | J12: t2 | K12: P2 | L12: M2 | M12: M1-M2 | O12: Qсум
D13: % | E13: гр.C | F13: кг/см | G13: тонн | H13: гр.С | I13: % | J13: гр.C | K13: кг/см2 | L13: тонн | M13: тонн | O13: Гкал
A14: [Report:Архив] | B14: [Время Опроса] | C14: 24 | D14: =RC[3]/(RC[-1]*R7C13)*100% -> #VALUE! | E14: [T1 сут] | F14: =R10C11*1 -> #VALUE! | G14: [М1 сут] | H14: =RC[-3]-RC[2] -> #VALUE! | I14: =RC[3]/(RC[-6]*R7C13)*100% -> #VALUE! | J14: [T2 сут] | K14: =R10C14*1 -> #VALUE! | L14: [М2 сут] | M14: =RC[-6]-RC[-1] -> #VALUE! | N14: [М3 сут] | O14: [Qтв1 сут] | Q14: [T3 сут] | R14: [Q2 ] | S14: [М3 сут]
B15: Среднее: | D15: =AVERAGE(R[-2]C:R[-1]C) -> #VALUE! | E15: =AVERAGE(R[-2]C:R[-1]C) -> #DIV/0! | F15: =AVERAGE(R[-2]C:R[-1]C) -> #VALUE! | G15: =AVERAGE(R[-2]C:R[-1]C) -> #DIV/0! | H15: =AVERAGE(R[-2]C:R[-1]C) -> #VALUE! | I15: =AVERAGE(R[-2]C:R[-1]C) -> #VALUE! | J15: =AVERAGE(R[-2]C:R[-1]C) -> #DIV/0! | K15: =AVERAGE(R[-2]C:R[-1]C) -> #VALUE! | L15: =AVERAGE(R[-2]C:R[-1]C) -> #DIV/0! | M15: =AVERAGE(R[-2]C:R[-1]C) -> #VALUE! | N15: =AVERAGE(R[-2]C:R[-1]C) -> #DIV/0! | O15: =AVERAGE(R[-2]C:R[-1]C) -> #DIV/0!
B16: Итого: | C16: =SUM(R[-3]C:R[-2]C) -> 24 | G16: =SUM(R[-3]C:R[-2]C) -> 0 | L16: =SUM(R[-3]C:R[-2]C) -> 0 | M16: =SUM(R[-3]C:R[-2]C) -> #VALUE! | N16: =SUM(R[-3]C:R[-2]C) -> 0 | O16: =SUM(R[-3]C:R[-2]C) -> 0
B17: По среднему с 19.02.07 по 24.02.07 | L17: =R[-2]C*6 -> #DIV/0! | M17: =R[-2]C*6 -> #VALUE! | N17: =R[-2]C*6 -> #DIV/0! | O17: =R[-2]C*6 -> #DIV/0!
B18: Итого: | L18: =R[-2]C+R[-1]C -> #DIV/0! | M18: =R[-2]C+R[-1]C -> #VALUE! | N18: =R[-2]C+R[-1]C -> #DIV/0! | O18: =R[-2]C+R[-1]C -> #DIV/0!
B19: Показания параметров теплопотребления по теплосчетчику нарастающим итогом:
B20: Дата | E20: M1, т | G20: M2, т | I20: Qсум, Гкал | K20: Mгвс,т | M20: Tраб., час
A21: [Report:Итоговые] | B21: [Время Опроса] | E21: [M1 сум] | G21: [M2 сум] | I21: [Qтв1 сум] | K21: [M3 сум] | M21: [TSUM1 сум]
D23: Отчет сдал | H23: Сухих Л.А.

Sheet: Отчет (2)
A1: [Report:Информация] | E1: Отчет о теплопотреблении по приборам УУТЭ | M1: [Конечная дата]
A2: [Report:Информация] | B2: Абонент: ОАО "СЗТ" Петербургский филиал Договор: | J2: [Договор] | M2: тел. 575-22-48 | P2: Узел учета: | R2: [Узел учета]
A3: [Report:Информация] | B3: Адрес: | C3: [Имя Узла Учета] | E3: [Адрес Узла Учета] | I3: Строительный адрес: | M3: [Стр.адрес] | P3: Код УУТЭ: | R3: [Код УУТЭ]
A4: [Report:Информация] | B4: Обслуживающая организация: Цех СОТ УОП Петербургского филиала ОАО "СЗТ" | O4: Телефон: 575-22-44
A5: [Report:Информация] | B5: Источник: | D5: [Источник] | H5: Схема подключения: | K5: [Сист_теплопотребления] | Q5: график | S5: [Т_график]
A6: [Report:Информация] | B6: Установлены приборы: | G6: Часовые архивы в файле: | K6: [Часов_архив] | Q6: Тхв,гр.С = | S6: [Тхв]
A7: [Report:Информация] | B7: Вычислитель: | D7: [Марка Счетчика] | F7: [№ прибора] | H7: Режим(схема): | J7: [Схема] | L7: Приборы УУТЭ поверены до : | R7: [Дата поверки]
A8: [Report:Информация] | B8: Подающ.тр.(М1): | E8: расходомер: | G8: [Расходомер] | I8: Gmin= | J8: [Gпр_minПР] | K8: Gmax= | M8: [GпрПР] | O8: Термопреобр.: | R8: [Термопреобр]
A9: [Report:Информация] | B9: Обратн.тр.(М2): | E9: расходомер: | G9: [Расходомер] | I9: Gmin= | J9: [Gпр_minПР] | K9: Gmax= | M9: [GпрПР] | O9: Термопреобр.: | R9: [Термопреобр]
A10: [Report:Информация] | B10: тр-д ГВС(М3): | E10: расходомер: | G10: [Расходомер ГВС] | I10: Gmin= | J10: [Gпр(гвс min)] | K10: Gmax= | M10: [G(гвс)ПР] | O10: Термопреобр.: | R10: [Термопреобр ГВС]
A11: [Report:Информация] | B11: тр.цирк.ГВС(М4): | E11: расходомер: | I11: Gmin= | K11: Gmax= | O11: Термопреобр.:
A12: [Report:Информация] | B12: тр.подпитки(V5): | E12: расходомер: | I12: Gmin= | K12: Gmax= | O12: Термопреобр.:
A13: [Report:Информация] | B13: Расчетный алгоритм: | G13: зима: | H13: [Формула] | N13: лето: | P13: [Формула2]
A14: [Report:Информация] | B14: Договорные нагрузки,Гкал/час: | G14: Qот.= | H14: [Qот] | I14: Qвент.= | J14: [Qвент] | L14: Qтех.= | M14: [Qтех] | N14: Qтех.гвс= | P14: [Qтех_гвс] | Q14: Qгвс.= | S14: [Qгвс]
A15: [Report:Информация] | B15: Договорные нагрузки (ср.час),Гкал/час: | I15: Qтех.гвс ср= | K15: [Qтех_гвс ср] | O15: Qгвс.ср= | Q15: [Qгвс ср]
A16: [Report:Информация] | B16: Договорн. нагрузки (ср.сут),т/сут: | G16: Gот.= | H16: [Gот] | I16: Gвент.= | J16: [Gвент] | L16: Gтех.= | M16: [Gтех] | N16: Gгвс.= | P16: [Gгвс] | Q16: Gгвс.м = | S16: [Gгвс_м]
A17: [Report:Информация] | B17: Конст.значения: | E17: Р1= | F17: [Рпр] | G17: Р2= | H17: [Робр] | I17: t1= | J17: [Т1] | K17: t2= | L17: [Т2] | M17: t3= | O17: t4=
B18: Фактическое потребление за предыдущий отчетный период
E19: Учет (ТВ-1) | M19: Контроль (ТВ-2)
B20: Дата | C20: Ти | D20: НС | E20: М1, | F20: М2, | G20: dМ, | H20: Т1, | I20: Т2, | J20: dТ, | K20: P1, | L20: P2, | M20: М3 | N20: M4, | O20: dM, | P20: V5, | Q20: Т3, | R20: Т4, | S20: Q | U20: Qгвс
C21: час | E21: т | F21: т | G21: т | H21: С | I21: С | J21: С | K21: кг/см2 | L21: кг/см2 | M21: т | N21: т | O21: т | P21: м.куб | Q21: С | R21: С | S21: Гкал
A22: [Report:Архив] | B22: [Время Опроса] | C22: 24 | E22: [M1 сут] | F22: [М2 сут] | G22: =RC[-2]-RC[-1] -> #VALUE! | H22: [T1 сут] | I22: [T2 сут] | J22: =RC[-2]-RC[-1] -> #VALUE! | K22: =R17C6*1 -> #VALUE! | L22: =R17C8*1 -> #VALUE! | N22: [М4 сут] | R22: [T4 сут] | S22: [Q1 сут] | U22: [Q2 сут]
B23: Среднее: | C23: =AVERAGE(R[-2]C:R[-1]C) -> 24 | E23: =AVERAGE(R[-2]C:R[-1]C) -> #DIV/0! | F23: =AVERAGE(R[-2]C:R[-1]C) -> #DIV/0! | G23: =AVERAGE(R[-2]C:R[-1]C) -> #VALUE! | H23: =AVERAGE(R[-2]C:R[-1]C) -> #DIV/0! | I23: =AVERAGE(R[-2]C:R[-1]C) -> #DIV/0! | J23: =AVERAGE(R[-2]C:R[-1]C) -> #VALUE! | K23: =AVERAGE(R[-2]C:R[-1]C) -> #VALUE! | L23: =AVERAGE(R[-2]C:R[-1]C) -> #VALUE! | N23: =AVERAGE(R[-2]C:R[-1]C) -> #DIV/0! | R23: =AVERAGE(R[-2]C:R[-1]C) -> #DIV/0! | S23: =AVERAGE(R[-2]C:R[-1]C) -> #DIV/0! | U23: =AVERAGE(R[-2]C:R[-1]C) -> #DIV/0!
B24: Итого | C24: =SUM(R[-3]C:R[-2]C) -> 24 | E24: =SUM(R[-3]C:R[-2]C) -> 0 | F24: =SUM(R[-3]C:R[-2]C) -> 0 | G24: =SUM(R[-3]C:R[-2]C) -> #VALUE! | N24: =SUM(R[-3]C:R[-2]C) -> 0 | S24: =SUM(R[-3]C:R[-2]C) -> 0 | U24: =SUM(R[-3]C:R[-2]C) -> 0
B25: Итого по приборам учета:
B26: Среднее:
B27: Итого:
B28: Показания счетчиков на момент снятия данных:
B29: Дата | D29: М1, т | F29: М2, т | H29: М3,т | J29: М4,т | L29: V5,м.куб | N29: Q, Гкал | Q29: Ти,ч | U29: Qгвс, Гкал
A30: [Report:Итоговые] | B30: [Время Опроса] | D30: [M1 сум] | F30: [M2 сум] | J30: [M4 сум] | N30: [Qтв1 сум] | Q30: [TSUM1] | U30: [Qтв2 сум]
B31: Период расчета по среднему:
B32: Период расчета по договору:
B33: Период превышения t2:
B34: Инженер ОПУ района Дирекции "Энергосбыт"ГУП "ТЭК СПб" | O34: / | R34: /
B36: Ответственный за учет тепловой энергии (от абонента) | O36: / | P36: Сухих Л.А. /
A41: [Report:Информация] | F41: Акт о теплопотреблении за | K41: [Конечная дата]
A43: [Report:Информация] | B43: Мы, нижеподписавшиеся: сотрудник Управления реализации дирекции Энергосбыт ГУП "ТЭК СПб" | Q43: [Фамилия]
A44: [Report:Информация] | B44: и представитель абонента | F44: [Имя Узла Учета] | H44: расположенного по адресу: | L44: [Адрес Узла Учета] | P44: составили
B45: настоящий акт в том, что за период включительно энергоснабжающая организация отпустила,
B46: а абонент принял тепловую энергию в количестве:
B47: Фактическое потребление за предыдущий отчетный период: | P47: = | S47: Гкал
B48: Расчетное потребление за предыдущий период: | P48: = | S48: Гкал
B49: Фактическое потребление за текущий отчетный период: | P49: = | S49: Гкал
B50: Расчетное потребление до конца месяца: | P50: = | S50: Гкал
B51: Корректировка на температуру холодной воды на источнике теплоснабжения | N51: гр.С | P51: = | S51: Гкал
B52: Расчет по среднему за период: | P52: = | S52: Гкал
B53: Расчет по договорным нагрузкам за период: | P53: = | S53: Гкал
B54: Досчет за нарушение договорных обязательств: | P54: = | S54: Гкал
B56: Итого: | P56: = | S56: Гкал
B60: Представитель абонента | Q60: Сухих Л.А.
A62: [Report:Информация] | B62: Сотрудник Управления реализации дирекции "Энергосбыт" ГУП"ТЭК СПб" | Q62: [Фамилия]